{
  "email": "user@example.com",
  "first_name": "example_value",
  "last_name": "example_value",
  "position": "example_value",
  "company": "example_value",
  "company_industry": "example_value",
  "company_size": "example_value",
  "confidence_score": 10,
  "website": "example_value",
  "country_code": "example_value",
  "linkedin_url": "https://www.example.com",
  "phone_number": "example_value",
  "twitter": "example_value",
  "notes": "example_value",
  "leads_list_id": "500123"
}